{
  "$schema": "https://json-schema.org/draft/2020-12/schema",
  "$id": "https://railtech.uz/contracts/events/envelope.v1.json",
  "title": "Конверт события rt_bus v1",
  "description": "CloudEvents 1.0, structured mode, JSON (ADR-0014; docs/CONTRACTS.md, раздел «Шина rt_bus»). Поле data проверяется отдельно схемой своего типа: uz.railtech.<домен>.<сущность>.<действие>.v<N> ↔ events/<домен>/<сущность>.<действие>.v<N>.json; dataschema — rt://contracts/events/<домен>/<сущность>.<действие>/v<N>. Отправитель строгий: заполняет все обязательные атрибуты по этой схеме. Читатель терпимый: неизвестные атрибуты-расширения CloudEvents (имена [a-z0-9]{1,20}) допускаются и игнорируются.",
  "type": "object",
  "required": [
    "specversion",
    "id",
    "source",
    "type",
    "time",
    "datacontenttype",
    "dataschema",
    "tenant",
    "correlationid",
    "data"
  ],
  "properties": {
    "specversion": {
      "type": "string",
      "const": "1.0",
      "description": "Версия CloudEvents"
    },
    "id": {
      "type": "string",
      "format": "uuid",
      "description": "Идентификатор события (UUID); ключ дедупликации inbox и заголовок X-RT-Event-Id"
    },
    "source": {
      "type": "string",
      "pattern": "^rt://[a-z][a-z0-9-]{0,62}$",
      "description": "Издатель: rt://crm, rt://erp, rt://eds, rt://platform-bff; коннекторы — rt://connector-<имя>. События домена identity v1 публикует CRM (rt://crm, ADR-0015)"
    },
    "type": {
      "type": "string",
      "pattern": "^uz\\.railtech\\.(crm|erp|eds|identity|platform)\\.[a-z][a-z0-9_]*\\.[a-z][a-z0-9_]*\\.v[1-9][0-9]*$",
      "description": "uz.railtech.<домен>.<сущность>.<действие>.v<N>; сущность и действие — по одному сегменту snake_case"
    },
    "time": {
      "type": "string",
      "format": "date-time",
      "description": "Момент события, RFC 3339 в UTC (суффикс Z; отправитель всегда пишет UTC, читатель принимает любое смещение)"
    },
    "subject": {
      "type": "string",
      "minLength": 1,
      "maxLength": 200,
      "description": "Необязательно: объект события в понятном человеку виде (номер сделки, КП, клиента); без персональных данных"
    },
    "datacontenttype": {
      "type": "string",
      "const": "application/json"
    },
    "dataschema": {
      "type": "string",
      "pattern": "^rt://contracts/events/(crm|erp|eds|identity|platform)/[a-z][a-z0-9_]*\\.[a-z][a-z0-9_]*/v[1-9][0-9]*$",
      "description": "rt://contracts/events/<домен>/<сущность>.<действие>/v<N> — соответствует type"
    },
    "tenant": {
      "type": "string",
      "pattern": "^[a-z0-9][a-z0-9-]{0,62}$",
      "default": "railtech",
      "description": "Арендатор (компания-владелец ансамбля); v1 — railtech"
    },
    "correlationid": {
      "type": "string",
      "pattern": "^[A-Za-z0-9._:/+=-]{1,128}$",
      "description": "UUID или X-Request-ID исходного запроса; если его нет — новый UUID. Переносится в задачу обработчика, логи и заголовок X-Request-ID доставки"
    },
    "traceparent": {
      "type": "string",
      "pattern": "^[0-9a-f]{2}-[0-9a-f]{32}-[0-9a-f]{16}-[0-9a-f]{2}$",
      "description": "Необязательно: W3C Trace Context исходного запроса"
    },
    "data": {
      "type": "object",
      "description": "Тело события по схеме типа (dataschema)"
    }
  },
  "propertyNames": {
    "pattern": "^[a-z0-9]{1,20}$"
  },
  "additionalProperties": {
    "description": "Атрибут-расширение CloudEvents: читатель терпимый, неизвестные расширения игнорирует",
    "type": [
      "string",
      "boolean",
      "integer"
    ]
  }
}
