{
  "specversion": "1.0",
  "id": "fe0ddb22-c373-5a36-a88d-9cc1c096e856",
  "source": "rt://crm",
  "type": "uz.railtech.crm.client.updated.v1",
  "time": "2026-10-22T09:00:00Z",
  "subject": "client/42",
  "datacontenttype": "application/json",
  "dataschema": "rt://contracts/events/crm/client.updated/v1",
  "tenant": "railtech",
  "correlationid": "d22ea247-795d-57b8-8199-35d0692322b5",
  "data": {
    "client": {
      "crm_client_id": 42,
      "erp_company_id": 118,
      "name": "ООО «Пример Логистик»",
      "inn": "300000001",
      "segment": "rail",
      "is_active": true,
      "owner": {
        "crm_user_id": 7,
        "full_name": "Алия Каримова"
      },
      "updated_at": "2026-10-22T09:00:00Z"
    },
    "changed_fields": [
      "name",
      "inn"
    ],
    "actor": {
      "type": "staff",
      "crm_user_id": 1
    }
  }
}
