{
  "specversion": "1.0",
  "id": "5e43403f-e5ef-5b89-94b6-1e00da58faea",
  "source": "rt://erp",
  "type": "uz.railtech.erp.invoice.issued.v1",
  "time": "2026-10-17T04:00:00Z",
  "subject": "D-2026-0905",
  "datacontenttype": "application/json",
  "dataschema": "rt://contracts/events/erp/invoice.issued/v1",
  "tenant": "railtech",
  "correlationid": "3527d743-e133-5f7d-8f05-d8f3e9775f52",
  "traceparent": "00-4bf92f3577b34da6a3ce929d0e0e4736-00f067aa0ba902b7-01",
  "data": {
    "erp_company_id": 118,
    "crm_client_id": 42,
    "deal": {
      "erp_deal_id": 905,
      "number": "D-2026-0905",
      "title": "Поставка оборудования, партия 1",
      "stage": "invoiced",
      "amount": "125000000.00",
      "currency": "UZS"
    },
    "actor": {
      "type": "staff",
      "name": "Расчётчик"
    },
    "payload": {
      "erp_invoice_id": 4410,
      "number": "СЧ-2026-0441",
      "amount": "62500000.00",
      "currency": "UZS",
      "due_date": "2026-10-24",
      "link": "https://cabinet.railtech.uz/invoices/4410"
    }
  }
}
