{
  "specversion": "1.0",
  "id": "5d1a3f0c-9b7e-5c11-a0f2-6f0e5a1c7d21",
  "source": "rt://erp",
  "type": "uz.railtech.erp.contract.status_changed.v1",
  "time": "2026-10-28T06:30:00Z",
  "subject": "D-2026-0905",
  "datacontenttype": "application/json",
  "dataschema": "rt://contracts/events/erp/contract.status_changed/v1",
  "tenant": "railtech",
  "correlationid": "3c8a54a2-0d9e-5b0c-8a3b-1f4b7d9a6e10",
  "traceparent": "00-4bf92f3577b34da6a3ce929d0e0e4736-00f067aa0ba902b7-01",
  "data": {
    "erp_company_id": 118,
    "crm_client_id": 42,
    "deal": {
      "erp_deal_id": 905,
      "number": "D-2026-0905",
      "title": "Поставка оборудования, партия 1",
      "stage": "contract",
      "amount": "125000000.00",
      "currency": "UZS"
    },
    "actor": {
      "type": "staff",
      "name": "Бухгалтер"
    },
    "payload": {
      "erp_contract_id": 311,
      "number": "ДОГ-2026/118",
      "status": "issued_at_operator",
      "sent_to_client": true,
      "amount": "125000000.00",
      "currency": "UZS"
    }
  }
}
