{
  "specversion": "1.0",
  "id": "493b60e8-f00d-5251-8360-1c2dc9de023f",
  "source": "rt://crm",
  "type": "uz.railtech.crm.lead.stage_changed.v1",
  "time": "2026-10-22T08:20:00Z",
  "subject": "lead/501",
  "datacontenttype": "application/json",
  "dataschema": "rt://contracts/events/crm/lead.stage_changed/v1",
  "tenant": "railtech",
  "correlationid": "1bf896c9-fbba-5609-a283-0e2ad283ea4f",
  "data": {
    "lead": {
      "crm_lead_id": 501,
      "crm_client_id": 42,
      "display_name": "Иван Петров",
      "company_name": "ООО «Пример Логистик»",
      "stage": "qualified",
      "source": "telegram",
      "language": "ru",
      "score": 70,
      "assigned_user": {
        "crm_user_id": 7,
        "full_name": "Алия Каримова"
      },
      "erp_request_id": null,
      "updated_at": "2026-10-22T08:20:00Z"
    },
    "from": "engaged",
    "to": "qualified",
    "reason": "Квалификация пройдена",
    "actor": {
      "type": "bot"
    }
  }
}
