{
  "specversion": "1.0",
  "id": "5a0e1c33-7b42-4f5e-9c1d-2a3b4c5d6e7f",
  "source": "rt://erp",
  "type": "uz.railtech.erp.mail.requested.v1",
  "time": "2026-10-28T09:15:00Z",
  "datacontenttype": "application/json",
  "dataschema": "rt://contracts/events/erp/mail.requested/v1",
  "tenant": "railtech",
  "correlationid": "3f0c1d2e-4b5a-4c6d-8e7f-90a1b2c3d4e5",
  "subject": "mail/erp:email_log:5120",
  "data": {
    "request_key": "erp:email_log:5120",
    "purpose": "quote_sent",
    "to": [
      "buyer@example.com"
    ],
    "subject": "Коммерческое предложение КП-2026-0142",
    "language": "ru",
    "ref": {
      "kind": "quote",
      "id": "981"
    },
    "notify": true,
    "attachments": [
      {
        "filename": "КП-2026-0142.pdf",
        "content_type": "application/pdf",
        "size": 184320,
        "sha256": "9f2c4a1b7e3d5c6a8b0f1e2d3c4b5a69788796a5b4c3d2e1f0a9b8c7d6e5f4a3"
      }
    ],
    "content": {
      "alg": "fernet-pair-v1",
      "ciphertext": "gAAAAABnH0x5ZXhhbXBsZS1jaXBoZXJ0ZXh0LW5vdC1hLXJlYWwtdG9rZW4tLXRleHQtaHRtbC1hbmQtbGlua3M="
    }
  }
}
