{
  "specversion": "1.0",
  "id": "a3f0aabe-42e8-58a7-9751-5a09936cebd9",
  "source": "rt://erp",
  "type": "uz.railtech.erp.quote.sent.v1",
  "time": "2026-10-13T04:15:00Z",
  "subject": "D-2026-0905",
  "datacontenttype": "application/json",
  "dataschema": "rt://contracts/events/erp/quote.sent/v1",
  "tenant": "railtech",
  "correlationid": "9a4f96ed-2afb-58ba-a770-b6537af76da4",
  "traceparent": "00-4bf92f3577b34da6a3ce929d0e0e4736-00f067aa0ba902b7-01",
  "data": {
    "erp_company_id": 118,
    "crm_client_id": 42,
    "deal": {
      "erp_deal_id": 905,
      "number": "D-2026-0905",
      "title": "Поставка оборудования, партия 1",
      "stage": "quote_sent",
      "amount": "125000000.00",
      "currency": "UZS"
    },
    "actor": {
      "type": "staff",
      "name": "Расчётчик"
    },
    "payload": {
      "erp_quote_id": 1203,
      "version": 2,
      "public_url": "https://cabinet.railtech.uz/q/abc123",
      "valid_until": "2026-10-27",
      "total": "125000000.00",
      "currency": "UZS"
    }
  }
}
