{
  "specversion": "1.0",
  "id": "d6282c87-f842-565a-af20-3f9f31182a39",
  "source": "rt://erp",
  "type": "uz.railtech.erp.quote.acceptance_code_requested.v1",
  "time": "2026-10-14T05:18:00Z",
  "subject": "D-2026-0905",
  "datacontenttype": "application/json",
  "dataschema": "rt://contracts/events/erp/quote.acceptance_code_requested/v1",
  "tenant": "railtech",
  "correlationid": "967ec04e-83a2-560a-a22c-d44b98033f0f",
  "traceparent": "00-4bf92f3577b34da6a3ce929d0e0e4736-00f067aa0ba902b7-01",
  "data": {
    "erp_company_id": 118,
    "crm_client_id": 42,
    "deal": {
      "erp_deal_id": 905,
      "number": "D-2026-0905",
      "title": "Поставка оборудования, партия 1",
      "stage": "quote_sent",
      "amount": "125000000.00",
      "currency": "UZS"
    },
    "actor": {
      "type": "client",
      "name": "Иван Петров"
    },
    "payload": {
      "erp_quote_id": 1203,
      "version": 2,
      "erp_contact_id": 311,
      "crm_contact_id": 57,
      "code": "000000",
      "expires_at": "2026-10-14T10:33:00+05:00"
    }
  }
}
