{
  "specversion": "1.0",
  "id": "0329d640-0dd3-5393-9f8f-1d88e452befb",
  "source": "rt://crm",
  "type": "uz.railtech.crm.contact.created.v1",
  "time": "2026-10-22T09:04:00Z",
  "subject": "contact/58",
  "datacontenttype": "application/json",
  "dataschema": "rt://contracts/events/crm/contact.created/v1",
  "tenant": "railtech",
  "correlationid": "3b9daab2-1ea7-522d-a163-f4e33609d13e",
  "data": {
    "contact": {
      "crm_contact_id": 58,
      "crm_client_id": 42,
      "erp_company_id": 118,
      "full_name": "Иван Петров",
      "position": "Начальник снабжения",
      "phone_e164": "+998900000001",
      "email": "ivan.petrov@example.com",
      "telegram_user_id": 100000001,
      "is_primary": true,
      "language": "ru",
      "preferred_channel": "telegram",
      "updated_at": "2026-10-22T09:04:00Z"
    },
    "actor": {
      "type": "staff",
      "crm_user_id": 1
    }
  }
}
