{
  "specversion": "1.0",
  "id": "083780d5-e12c-5591-b123-d9a0d2a48ac5",
  "source": "rt://erp",
  "type": "uz.railtech.erp.delivery.line_accepted.v1",
  "time": "2026-11-21T05:00:00Z",
  "subject": "D-2026-0905",
  "datacontenttype": "application/json",
  "dataschema": "rt://contracts/events/erp/delivery.line_accepted/v1",
  "tenant": "railtech",
  "correlationid": "1eb1fe68-a9dc-5c30-bd19-eaa643e08106",
  "traceparent": "00-4bf92f3577b34da6a3ce929d0e0e4736-00f067aa0ba902b7-01",
  "data": {
    "erp_company_id": 118,
    "crm_client_id": 42,
    "deal": {
      "erp_deal_id": 905,
      "number": "D-2026-0905",
      "title": "Поставка оборудования, партия 1",
      "stage": "fulfilment",
      "amount": "125000000.00",
      "currency": "UZS"
    },
    "actor": {
      "type": "client",
      "name": "Иван Петров"
    },
    "payload": {
      "line_no": 1,
      "title": "Насос центробежный CM 50-200",
      "status": "accepted",
      "remark": null,
      "decided_at": "2026-11-21T10:00:00+05:00"
    }
  }
}
