{
  "specversion": "1.0",
  "id": "5e53d01f-c29d-5844-a3de-137f59b573f4",
  "source": "rt://erp",
  "type": "uz.railtech.erp.quote.accepted.v1",
  "time": "2026-10-14T05:20:00Z",
  "subject": "D-2026-0905",
  "datacontenttype": "application/json",
  "dataschema": "rt://contracts/events/erp/quote.accepted/v1",
  "tenant": "railtech",
  "correlationid": "433e0b1b-accc-513e-addc-1a093e958748",
  "traceparent": "00-4bf92f3577b34da6a3ce929d0e0e4736-00f067aa0ba902b7-01",
  "data": {
    "erp_company_id": 118,
    "crm_client_id": 42,
    "deal": {
      "erp_deal_id": 905,
      "number": "D-2026-0905",
      "title": "Поставка оборудования, партия 1",
      "stage": "accepted",
      "amount": "125000000.00",
      "currency": "UZS"
    },
    "actor": {
      "type": "client",
      "name": "Иван Петров"
    },
    "payload": {
      "erp_quote_id": 1203,
      "version": 2,
      "erp_contact_id": 311,
      "crm_contact_id": 57
    }
  }
}
